{
  "$schema": "https://json-schema.org/draft/2020-12/schema",
  "$id": "https://github.com/dreamabout/kaikei-envelope/schemas/v2/order_refunded.payload.schema.json",
  "title": "order.refunded payload",
  "type": "object",
  "additionalProperties": false,
  "required": [
    "order_id",
    "reason",
    "items",
    "refund_payments"
  ],
  "properties": {
    "order_id": {
      "type": "string",
      "minLength": 1
    },
    "customer": {
      "$ref": "#/$defs/customer"
    },
    "reason": {
      "type": "string",
      "enum": [
        "customer_request",
        "chargeback",
        "merchant_initiated",
        "other"
      ]
    },
    "items": {
      "type": "array",
      "minItems": 1,
      "items": {
        "$ref": "#/$defs/item"
      }
    },
    "refund_payments": {
      "type": "array",
      "items": {
        "$ref": "#/$defs/refund_payment"
      },
      "description": "Non-empty, unless unpaid is true: then it must be empty."
    },
    "currency": {
      "type": "string",
      "pattern": "^[A-Z]{3}$"
    },
    "fx_rate": {
      "type": "string",
      "pattern": "^-?\\d+\\.\\d{2}$"
    },
    "prepayment_event_id": {
      "type": "string",
      "pattern": "^[0-9A-HJKMNP-TV-Z]{26}$"
    },
    "credit_note_number": {
      "type": "string",
      "minLength": 1
    },
    "unpaid": {
      "type": "boolean",
      "description": "The order was never paid (1.17.0): this credit note closes the receivable and moves no money, so refund_payments is empty and the sum invariant does not apply. Explicit rather than inferred from an empty refund_payments, which without it stays an error. Cannot be combined with prepayment_event_id (tier 3)."
    }
  },
  "if": {
    "properties": {
      "unpaid": {
        "const": true
      }
    },
    "required": [
      "unpaid"
    ]
  },
  "then": {
    "properties": {
      "refund_payments": {
        "maxItems": 0
      }
    }
  },
  "else": {
    "properties": {
      "refund_payments": {
        "minItems": 1
      }
    }
  },
  "$defs": {
    "customer": {
      "type": "object",
      "required": [
        "country_code",
        "is_b2b"
      ],
      "properties": {
        "country_code": {
          "type": "string",
          "pattern": "^[A-Z]{2}$"
        },
        "postal_code": {
          "type": "string",
          "pattern": "^[A-Za-z0-9][A-Za-z0-9 -]{0,11}$",
          "description": "DELIVERY postal code, from the same address as country_code. Determines the VAT territory: 78266 is Buesingen (outside the EU VAT area entirely), 6691 is Jungholz (19%, not Austria's 20%). A billing postal code paired with a delivery country is wrong in exactly the cases this exists to catch."
        },
        "is_b2b": {
          "type": "boolean"
        },
        "customer_id": {
          "type": "string",
          "minLength": 1
        },
        "name": {
          "type": "string"
        },
        "email": {
          "type": "string"
        },
        "vat_number": {
          "type": "string"
        },
        "ean_number": {
          "type": "string",
          "pattern": "^[0-9]{13}$"
        },
        "address": {
          "$ref": "#/$defs/address"
        }
      }
    },
    "address": {
      "type": "object",
      "properties": {
        "street": {
          "type": "string"
        },
        "city": {
          "type": "string"
        },
        "postal_code": {
          "type": "string"
        },
        "country": {
          "type": "string",
          "pattern": "^[A-Z]{2}$"
        }
      }
    },
    "item": {
      "type": "object",
      "required": [
        "type",
        "gross_amount",
        "vat_amount",
        "vat_rate"
      ],
      "properties": {
        "type": {
          "type": "string",
          "enum": [
            "physical",
            "gift_card",
            "digital",
            "shipping",
            "fee",
            "giftwrapping",
            "discount",
            "customer_credit"
          ],
          "description": "customer_credit (1.20.0) pays back a balance owed to the customer -- an overpayment, or an order made smaller after it was paid. Not a sale: negative gross_amount, vat_amount and vat_rate zero, no sku, quantity or unit_cost (tier 3)."
        },
        "gross_amount": {
          "type": "string",
          "pattern": "^-?\\d+\\.\\d{2}$"
        },
        "vat_amount": {
          "type": "string",
          "pattern": "^-?\\d+\\.\\d{2}$"
        },
        "vat_rate": {
          "type": "string",
          "pattern": "^-?\\d+\\.\\d{2,4}$"
        },
        "unit_cost": {
          "type": "string",
          "pattern": "^\\d+\\.\\d{2}$"
        }
      }
    },
    "refund_payment": {
      "type": "object",
      "required": [
        "gateway",
        "original_transaction_id",
        "refund_transaction_id",
        "amount"
      ],
      "properties": {
        "gateway": {
          "type": "string",
          "minLength": 1
        },
        "original_transaction_id": {
          "type": "string",
          "minLength": 1
        },
        "refund_transaction_id": {
          "type": "string",
          "minLength": 1
        },
        "amount": {
          "type": "string",
          "pattern": "^-?\\d+\\.\\d{2}$"
        }
      }
    }
  }
}
