{
    "order_id": "O-312",
    "reason": "customer_request",
    "items": [
        { "type": "customer_credit", "gross_amount": "-50.00", "vat_amount": "-10.00", "vat_rate": "0.25" }
    ],
    "refund_payments": [
        { "gateway": "paypal", "original_transaction_id": "pp_orig", "refund_transaction_id": "pp_refund", "amount": "50.00" }
    ]
}
